标题,评分,评分人数,导演,主演,类型,上映日期,片长,剧情简介,海报图片,制片国家/地区,语言,又名,IMDb,豆瓣url,集数,单集片长
镜中人 Look Away,6.3,13332,阿萨夫·伯恩斯坦,"英迪娅·埃斯利, 詹森·艾萨克, 佩内洛普·米契尔, 米拉·索维诺, 哈里森·吉尔伯特森, 克里斯汀·哈里斯, 亚当·哈蒂格, 康纳·彼得森, 辛蒂·迈斯科",惊悚,2018-10-12(美国),103分钟,"十八岁女孩玛丽亚（英迪娅·埃斯利 饰）经常受到同学欺负，使她变得自卑，害怕。有一天她发现镜子里的另一个她，艾兰。
                                    
                                　　艾兰（英迪娅·埃斯利 饰）既勇敢又无畏，帮助玛丽亚开启了复仇之路......",https://img9.doubanio.com/view/photo/s_ratio_poster/public/p2535338885.jpg,语言:,上映日期:,IMDb:,Unknown,https://movie.douban.com/subject/26942853/,Unknown,Unknown
雄狮少年,8.3,510115,孙海鹏,"大昕, 大雄, 郭皓, 李盟, 李佳思, 蔡壮壮, 马语非, 熊陈捷, 巴赫, 大澄子, 付博文, 秋木","剧情, 喜剧, 动画",2021-12-17(中国大陆),104分钟,"阿娟（大昕 配音）的父母在大城市打工养家，他留守在故乡，因为孱弱的体格和怯懦的性格常常遭到旁人的欺负。一次偶然中，阿娟邂逅了和自己同名的舞狮少女（秋木 配音），少女飒爽的英姿和如雷贯耳的话语激起了阿娟对舞狮这项传统活动的兴趣，他打算参加舞狮大赛来证明自己的能力，很快，阿娟的好友阿猫（大雄 配音）和阿狗（郭浩 配音）也加入了这个计划之中。
                                    
                                　　可是，舞狮哪有这么容易学，为了拜师，阿娟一行人找到了开鱼铺的咸鱼强（李盟 配音）。咸鱼强虽然现在活得窝囊，但曾经却是舞狮比赛的冠军，三个少年蓬勃的朝气和真挚的眼神打动了咸鱼强，重新唤醒了他对于舞狮的热爱。",https://img3.doubanio.com/view/photo/s_ratio_poster/public/p2702755317.jpg,语言:,上映日期:,IMDb:,Unknown,https://movie.douban.com/subject/35144311/,Unknown,Unknown
驻院医生 第六季 The Resident Season 6,8.0,276,No director found,马特·朱克瑞,剧情,2022-09-20(美国),No runtime found,FOX宣布续订《驻院医生》第六季。,https://img9.doubanio.com/view/photo/s_ratio_poster/public/p2876509836.jpg,语言:,首播:,Unknown,Unknown,https://movie.douban.com/subject/35910331/,单集片长:,IMDb:
骗子 꾼,7.5,47066,张昌原,"玄彬, 刘智泰, 朴成雄, 裴晟祐, 崔德文, 林珍娜, 安世河, 许成泰, 柳圣贤, 崔日华, 金溙勋, 廉东宪, 郑东奎, 崔宏一, 金子英, 周锡泰, 郑敏圣, 韩哲宇, 全宪泰, 李载求, 柳正浩, 孙炳旭, 郑镇荣, 车顺裴, 吴泰景, 陈善圭","剧情, 犯罪",2017-11-22(韩国),117分钟,为了逮捕涉及4万亿韩元、造成3万名受害者的稀世大骗子，诈骗犯（玄彬饰）和检察官展开较量的诈骗犯罪。玄彬将在片中饰演设下完美骗局的诈骗犯黄智成，是一位专挑诈骗犯行骗的天才诈骗犯；刘智泰在片中饰演劣性检察官朴熙洙，为抓住稀世大骗子而制定计划招揽黄智成，表面正义内里却是对权力有无尽欲望的人。电影新颖、烧脑的故事令人耳目一新，而两位演技派演员的互相飙戏也引发众多期待。电影计划于2016年下半年拍摄。,https://img9.doubanio.com/view/photo/s_ratio_poster/public/p2503067864.jpg,语言:,上映日期:,IMDb:,Unknown,https://movie.douban.com/subject/26770697/,Unknown,Unknown
魔兽 Warcraft,7.7,319726,邓肯·琼斯,"崔维斯·费米尔, 托比·凯贝尔, 宝拉·巴顿, 吴彦祖, 本·福斯特, 多米尼克·库珀, 鲁丝·内伽, 克兰西·布朗, 丹尼尔·库德摩尔, 罗伯特·卡辛斯基, 本·施耐泽, 格伦·克洛斯, 考乐姆·吉斯·雷尼, 泰瑞·诺塔里, 瑞安·罗宾斯, 博尔克利·杜菲尔德, 丹·佩恩, 迪伦·肖明, 唐尼·麦克尼尔, 迈克·安东纳科斯, 拉吉·拉尔","动作, 奇幻, 冒险",2016-06-08(中国大陆),124分钟,"这是一个人类和兽人共存，和谐相处，互不侵犯的世界。人类生活在艾泽拉斯大陆中，兽人则在德拉诺劳作繁衍。某日，邪恶的兽人古尔丹（吴彦祖 饰）出现了，它打开了黑暗之门，肆意屠戮手无寸铁的人类，将艾泽拉斯大陆变为了一片地狱的火海。与此同时，曾经与世无争的兽人们如今变得凶猛残暴，他们来到人类的领地，在这里烧杀抢掠，无恶不作。
                                    
                                　　杜隆坦（托比·凯贝尔 Toby Kebbell 饰）是霜狼氏族的酋长，他发现了古尔丹的野心和阴谋，于是带领着自己的部族千里迢迢来到了艾泽拉斯，在此处，人类领袖洛萨（崔维斯·费米尔 Travis Fimmel 饰）亦在寻找结束战争的两全之道。",https://img1.doubanio.com/view/photo/s_ratio_poster/public/p2345947329.jpg,语言:,上映日期:,IMDb:,官方小站:,https://movie.douban.com/subject/2131940/,Unknown,Unknown
